{
  "id": "usgs-sample-001",
  "provider": "USGS",
  "eventTimeUtc": "2026-04-29T10:24:00Z",
  "updatedTimeUtc": "2026-04-29T10:29:00Z",
  "latitudeDeg": 38.2,
  "longitudeDeg": 142.5,
  "depthKm": 34,
  "magnitude": 5.7,
  "place": "Off the east coast of Honshu, Japan",
  "sourceFeed": "sample-fixture",
  "derived": {
    "eventAgeMinutes": 31,
    "within81MinuteWindow": true,
    "scanlineWeight": 0.74,
    "registerMidi": 47
  }
}